<?xml version="1.0" encoding="UTF-8" standalone="no"?>
<!DOCTYPE template SYSTEM "template.dtd">
<template>
<title>Organisational Unit</title>
<!-- <regexp>^o=.*,</regexp> -->
<icon>images/ou.png</icon>
<description>New Organisational Unit</description>
<askcontainer>1</askcontainer>
<rdn>ou</rdn>
<visible>1</visible>

<objectClasses>
<objectClass id="organizationalUnit"></objectClass>
</objectClasses>

<attributes>
<attribute id="ou">
	<description>Organisational Unit</description>
	<display>Organisational Unit</display>
	<hint>don't include "ou="</hint>
	<order>1</order>
	<page>1</page>
</attribute>
</attributes>
</template>
