<?xml version="1.0" encoding="UTF-8" standalone="no"?>
<!DOCTYPE template SYSTEM "template.dtd">
<template>
<title>Courier Mail Alias</title>
<!--<regexp>^ou=People,o=.*,</regexp>-->
<icon>images/mail_alias.png</icon>
<description>New Courier Mail Alias</description>
<askcontainer>1</askcontainer>
<rdn>cn</rdn>
<visible>1</visible>
<invalid>0</invalid>

<objectClasses>
<objectClass id="inetOrgPerson"></objectClass>
<objectClass id="courierMailAlias"></objectClass>
</objectClasses>

<attributes>
<attribute id="cn">
	<display>Common Name</display>
	<order>1</order>
	<page>1</page>
</attribute>
<attribute id="sn">
	<display>Last name</display>
	<order>2</order>
	<page>1</page>
</attribute>
<attribute id="mail">
	<display>Email</display>
	<order>3</order>
	<page>1</page>
</attribute>
<attribute id="maildrop">
	<display>Maildrop</display>
	<order>4</order>
	<page>1</page>
</attribute>
</attributes>
</template>
