<?xml version="1.0" encoding="UTF-8" standalone="no"?>
<!DOCTYPE template SYSTEM "template.dtd">
<template>
<title>User Account</title>
<!--<regexp>^ou=People,o=.*,</regexp>-->
<icon>images/user.png</icon>
<description>New User Account</description>
<askcontainer>1</askcontainer>
<rdn>cn</rdn>
<visible>1</visible>

<objectClasses>
<objectClass id="inetOrgPerson"></objectClass>
<objectClass id="posixAccount"></objectClass>
</objectClasses>

<attributes>
<attribute id="givenName">
	<display>First name</display>
	<icon>images/uid.png</icon>
	<onchange>autoFill:cn,%givenName% %sn%</onchange>
	<order>1</order>
	<page>1</page>
</attribute>
<attribute id="sn">
	<display>Last name</display>
	<onchange>autoFill:cn,%givenName% %sn%</onchange>
	<onchange>autoFill:uid,%gidNumber|0-0/T%-%givenName|0-1/l%%sn/l%</onchange>
	<onchange>autoFill:homeDirectory,/home/users/%gidNumber|0-0/T%/%uid|3-%</onchange>
	<order>2</order>
	<page>1</page>
</attribute>
<attribute id="cn">
	<display>Common Name</display>
	<order>3</order>
	<page>1</page>
</attribute>
<attribute id="uid">
	<display>User ID</display>
	<onchange>autoFill:homeDirectory,/home/users/%gidNumber|0-0/T%/%uid|3-%</onchange>
	<order>4</order>
	<page>1</page>
	<spacer>1</spacer>
</attribute>
<attribute id="homeDirectory">
	<display>Home directory</display>
	<order>8</order>
	<page>1</page>
</attribute>
<attribute id="uidNumber">
	<display>UID Number</display>
	<hint>Automatically determined</hint>
	<icon>images/terminal.png</icon>
	<order>6</order>
	<page>1</page>
	<presubmit>=php.GetNextNumber(/,uid)</presubmit>
</attribute>
<attribute id="gidNumber">
	<display>GID Number</display>
	<onchange>autoFill:homeDirectory,/home/users/%gidNumber|0-0/T%/%uid|3-%</onchange>
	<order>7</order>
	<page>1</page>
	<value>=php.PickList(/,(objectClass=posixGroup),gidNumber,%cn%)</value>
</attribute>
<attribute id="loginShell">
	<display>Login shell</display>
	<order>9</order>
	<page>1</page>
	<value>=php.PickList(/,(objectClass=posixAccount),loginShell,%loginShell%)</value>
</attribute>
<attribute id="userPassword">
	<display>Password</display>
	<helper>
		<default>md5</default>
		<display>Encryption</display>
		<id>enc</id>
		<location>side</location>
		<value>blowfish</value>
		<value>clear</value>
		<value>crypt</value>
		<value>ext_des</value>
		<value>md5</value>
		<value>md5crypt</value>
		<value>sha</value>
		<value>smd5</value>
		<value>ssha</value>
	</helper>
	<icon>images/lock.png</icon>
	<order>5</order>
	<page>1</page>
	<post>=php.Password(%enc%,%userPassword%)</post>
	<spacer>1</spacer>
	<type>password</type>
	<verify>1</verify>
</attribute>
</attributes>
</template>
