<?xml version="1.0" encoding="UTF-8" standalone="no"?>
<!DOCTYPE template SYSTEM "template.dtd">
<template>
<title>Simple Security Object</title>
<!--<regexp>^ou=People,o=.*,</regexp>-->
<icon>images/user.png</icon>
<description>New Simple Security Object</description>
<askcontainer>1</askcontainer>
<rdn>userid</rdn>
<visible>1</visible>

<objectClasses>
<objectClass id="account"></objectClass>
<objectClass id="simpleSecurityObject"></objectClass>
</objectClasses>

<attributes>
<attribute id="userid">
	<display>User Name</display>
	<icon>images/uid.png</icon>
	<order>1</order>
	<page>1</page>
	<spacer>1</spacer>
</attribute>
<attribute id="userPassword">
	<display>Password</display>
	<helper>
		<default>md5</default>
		<display>Encryption</display>
		<id>enc</id>
		<location>side</location>
		<value>blowfish</value>
		<value>clear</value>
		<value>crypt</value>
		<value>ext_des</value>
		<value>md5</value>
		<value>md5crypt</value>
		<value>sha</value>
		<value>smd5</value>
		<value>ssha</value>
	</helper>
	<icon>images/lock.png</icon>
	<order>5</order>
	<page>1</page>
	<post>=php.Password(%enc%,%userPassword%)</post>
	<type>password</type>
	<verify>1</verify>
</attribute>
</attributes>
</template>
