<?xml version="1.0" encoding="UTF-8" standalone="no"?>
<!DOCTYPE template SYSTEM "template.dtd">
<template>
<title>Samba Domain</title>
<!--<regexp>^ou=People,o=.*,</regexp>-->
<icon>images/dc.png</icon>
<description>New Samba Domain</description>
<askcontainer>1</askcontainer>
<rdn>sambaDomainName</rdn>
<visible>1</visible>

<objectClasses>
<objectClass id="sambaDomain"></objectClass>
</objectClasses>

<attributes>
<attribute id="sambaDomainName">
	<display>Samba Domain Name</display>
	<order>1</order>
	<page>1</page>
</attribute>
<attribute id="sambaSID">
	<display>Samba SID</display>
	<hint>Samba SID is in the format S-1-5-21-x-y-z</hint>
	<order>2</order>
	<page>1</page>
	<value>S-1-5-21-</value>
</attribute>
</attributes>
</template>
