<?xml version="1.0" encoding="UTF-8" standalone="no"?>
<!DOCTYPE template SYSTEM "template.dtd">
<template>
<title>Sendmail Alias</title>
<!--<regexp>^ou=People,o=.*,</regexp>-->
<icon>images/mail.png</icon>
<description>New Sendmail Alias</description>
<askcontainer>1</askcontainer>
<rdn>sendmailMTACluster</rdn>
<visible>1</visible>
<invalid>1</invalid>

<objectClasses>
<objectClass id="sendmailMTAAliasObject"></objectClass>
</objectClasses>

<attributes>
<attribute id="sendmailMTACluster">
	<display>Sendmail Cluster Name</display>
	<icon>images/object.png</icon>
	<order>1</order>
	<page>1</page>
</attribute>
<attribute id="sendmailMTAHost">
	<display>Sendmail Hostname</display>
	<hint>Leave Blank</hint>
	<order>2</order>
	<page>1</page>
</attribute>
<attribute id="sendmailMTAKey">
	<display>Email alias</display>
	<order>3</order>
	<page>1</page>
</attribute>
<attribute id="sendmailMTAAliasValue">
	<display>Recipient Addresses</display>
	<order>4</order>
	<page>1</page>
	<type>textarea</type>
</attribute>
<attribute id="sendmailMTAAliasGrouping">
	<default>aliases</default>
	<hidden>1</hidden>
</attribute>
</attributes>
</template>
